{
  "schema_version": "1.0.0",
  "package": "epub_content_extractor",
  "markdown_files": [
    "docs/api/classes.md",
    "docs/api/exceptions.md",
    "docs/api/functions.md",
    "docs/api/index.md",
    "docs/api/models.md",
    "docs/architecture.md",
    "docs/changelog.md",
    "docs/compatibility.md",
    "docs/configuration.md",
    "docs/contracts/static-readiness.md",
    "docs/diagnostics.md",
    "docs/examples.md",
    "docs/examples/batch_usage.md",
    "docs/examples/error_handling.md",
    "docs/examples/how_to_start.md",
    "docs/examples/index.md",
    "docs/examples/public_api_examples.md",
    "docs/how-to-start.md",
    "docs/html-viewing-guide.md",
    "docs/index.md",
    "docs/input-output-contract.md",
    "docs/post-implementation-validation.md",
    "docs/public-api.md",
    "docs/security-archive-policy.md",
    "docs/source-of-truth.md",
    "docs/testing-guide.md",
    "docs/testing/README.md",
    "docs/testing/goldens/README.md",
    "docs/validation-guide.md"
  ],
  "schemas": [
    "docs/schemas/api-contract.schema.json",
    "docs/schemas/diagnostics-registry.schema.json",
    "docs/schemas/docs-manifest.schema.json",
    "docs/schemas/epub_canonical_text_build_options.v3.0.schema.json",
    "docs/schemas/epub_content_extractor.schema.json",
    "docs/schemas/epub_content_extractor.v3.0.schema.json",
    "docs/schemas/epub_content_extractor_config.schema.json",
    "docs/schemas/epub_content_extractor_config.v3.0.schema.json",
    "docs/schemas/epub_content_extractor_diagnostic_registry.v3.0.json",
    "docs/schemas/epub_content_extractor_diagnostic_registry.v3.0.schema.json",
    "docs/schemas/epub_content_extractor_error_registry.v3.0.json",
    "docs/schemas/epub_content_extractor_error_registry.v3.0.schema.json",
    "docs/schemas/epub_content_extractor_fixture_manifest.v3.0.schema.json",
    "docs/schemas/epub_content_extractor_golden_acceptance_manifest.v3.0.schema.json",
    "docs/schemas/epub_content_extractor_test_coverage_manifest.v3.0.schema.json",
    "docs/schemas/examples-manifest.schema.json",
    "docs/schemas/fixture-manifest.schema.json",
    "docs/schemas/mutation-probes.schema.json",
    "docs/schemas/test-coverage-manifest.schema.json",
    "docs/schemas/validation-manifest.schema.json"
  ],
  "contracts": [
    "docs/contracts/api-contract.yaml",
    "docs/contracts/diagnostics-registry.json",
    "docs/contracts/docs-manifest.json",
    "docs/contracts/error-registry.json",
    "docs/contracts/examples-manifest.json",
    "docs/contracts/fixture-manifest.json",
    "docs/contracts/mutation-probes.json",
    "docs/contracts/static-readiness.md",
    "docs/contracts/test-coverage-manifest.json",
    "docs/contracts/validation-manifest.json"
  ],
  "implementation_required_for_static_review": false
}
